{
  "$schema": "https://json-schema.org/draft/2020-12/schema",
  "title": "npamp_00 X25519MLKEM768 KEM-wire KAT",
  "description": "Schema for the N-PAMP draft-00 (spec/10 §4; ML-KEM-first) X25519MLKEM768 KEM-wire Known Answer Test vector. This is a standards-anchored, NON-CIRCULAR KAT: it carries RFC 7748 §6.1 X25519 anchors and NIST ACVP / FIPS 203 ML-KEM-768 anchors plus fixed wire-layout invariants, NOT bytes emitted by an N-PAMP implementation. It pins the hybrid-KEM wire byte order (combiner order) and component encodings.",
  "type": "object",
  "required": [
    "name",
    "spec",
    "kem_codepoint",
    "provenance",
    "purpose",
    "mlkem768_keygen",
    "x25519_rfc7748_6_1",
    "mlkem768_decaps_reference",
    "wire_layout",
    "coverage"
  ],
  "properties": {
    "name": {
      "const": "X25519MLKEM768 KEM-wire KAT",
      "description": "Identity of this vector."
    },
    "spec": {
      "type": "string",
      "pattern": "draft-00",
      "description": "Spec clause this vector pins; must reference N-PAMP draft-00."
    },
    "kem_codepoint": {
      "const": "0x11ec",
      "description": "Registered hybrid KEM code point for X25519MLKEM768, hex-prefixed."
    },
    "provenance": {
      "type": "string",
      "description": "Why the vector is non-circular: ML-KEM from NIST ACVP/FIPS 203, X25519 from RFC 7748, none generated by an N-PAMP impl."
    },
    "purpose": {
      "type": "string",
      "description": "What invariant the vector pins (the wire byte order / combiner-order surface)."
    },
    "mlkem768_keygen": {
      "type": "object",
      "description": "Deterministic ML-KEM-768 key generation from the FIPS 203 seed (d, z), NIST ACVP anchored.",
      "required": ["description", "source", "source_url", "seed_form", "d", "z", "ek"],
      "properties": {
        "description": { "type": "string" },
        "source": { "type": "string" },
        "source_url": { "type": "string" },
        "seed_form": { "type": "string" },
        "d": {
          "type": "string",
          "pattern": "^[0-9a-fA-F]+$",
          "minLength": 64,
          "maxLength": 64,
          "description": "FIPS 203 seed half d (32 bytes, 64 hex chars)."
        },
        "z": {
          "type": "string",
          "pattern": "^[0-9a-fA-F]+$",
          "minLength": 64,
          "maxLength": 64,
          "description": "FIPS 203 seed half z (32 bytes, 64 hex chars)."
        },
        "ek": {
          "type": "string",
          "pattern": "^[0-9a-fA-F]+$",
          "minLength": 2368,
          "maxLength": 2368,
          "description": "ML-KEM-768 encapsulation key (1184 bytes, 2368 hex chars)."
        }
      }
    },
    "x25519_rfc7748_6_1": {
      "type": "object",
      "description": "RFC 7748 §6.1 Curve25519 Diffie-Hellman test vector (raw scalars; crypto/ecdh clamps internally).",
      "required": ["description", "source", "source_url", "alice_private", "alice_public", "bob_private", "bob_public", "shared_secret"],
      "properties": {
        "description": { "type": "string" },
        "source": { "type": "string" },
        "source_url": { "type": "string" },
        "alice_private": {
          "type": "string",
          "pattern": "^[0-9a-fA-F]+$",
          "minLength": 64,
          "maxLength": 64,
          "description": "Alice X25519 private scalar (32 bytes, 64 hex chars)."
        },
        "alice_public": {
          "type": "string",
          "pattern": "^[0-9a-fA-F]+$",
          "minLength": 64,
          "maxLength": 64,
          "description": "Alice X25519 public key (32 bytes, 64 hex chars)."
        },
        "bob_private": {
          "type": "string",
          "pattern": "^[0-9a-fA-F]+$",
          "minLength": 64,
          "maxLength": 64,
          "description": "Bob X25519 private scalar (32 bytes, 64 hex chars)."
        },
        "bob_public": {
          "type": "string",
          "pattern": "^[0-9a-fA-F]+$",
          "minLength": 64,
          "maxLength": 64,
          "description": "Bob X25519 public key (32 bytes, 64 hex chars)."
        },
        "shared_secret": {
          "type": "string",
          "pattern": "^[0-9a-fA-F]+$",
          "minLength": 64,
          "maxLength": 64,
          "description": "X25519 ECDH shared secret (32 bytes, 64 hex chars)."
        }
      }
    },
    "mlkem768_decaps_reference": {
      "type": "object",
      "description": "NIST ML-KEM-768 encapsulation/decapsulation known-answer: ciphertext c, deterministic encaps randomness m, and shared secret K.",
      "required": ["description", "source", "source_url", "encaps_randomness_m", "shared_secret_K", "ciphertext_c"],
      "properties": {
        "description": { "type": "string" },
        "source": { "type": "string" },
        "source_url": { "type": "string" },
        "encaps_randomness_m": {
          "type": "string",
          "pattern": "^[0-9a-fA-F]+$",
          "minLength": 64,
          "maxLength": 64,
          "description": "Deterministic ML-KEM encapsulation randomness m (32 bytes, 64 hex chars)."
        },
        "shared_secret_K": {
          "type": "string",
          "pattern": "^[0-9a-fA-F]+$",
          "minLength": 64,
          "maxLength": 64,
          "description": "ML-KEM-768 shared secret K (32 bytes, 64 hex chars)."
        },
        "ciphertext_c": {
          "type": "string",
          "pattern": "^[0-9a-fA-F]+$",
          "minLength": 2176,
          "maxLength": 2176,
          "description": "ML-KEM-768 ciphertext c (1088 bytes, 2176 hex chars)."
        }
      }
    },
    "wire_layout": {
      "type": "object",
      "description": "How a conforming implementation MUST assemble the on-wire fields (ML-KEM-first) and the fixed component lengths.",
      "required": ["description", "kem_share", "kem_ciphertext", "combined_secret", "kem_share_len", "kem_ciphertext_len", "combined_secret_len"],
      "properties": {
        "description": { "type": "string" },
        "kem_share": { "type": "string", "description": "Assembly rule for the KEM share TLV (ek || x25519 public)." },
        "kem_ciphertext": { "type": "string", "description": "Assembly rule for the KEM ciphertext TLV (ml-kem ct || x25519 public)." },
        "combined_secret": { "type": "string", "description": "Assembly rule for the HKDF-Extract IKM (ml-kem SS || x25519 SS)." },
        "kem_share_len": { "const": 1216, "description": "KEM share length in octets (1184 + 32)." },
        "kem_ciphertext_len": { "const": 1120, "description": "KEM ciphertext length in octets (1088 + 32)." },
        "combined_secret_len": { "const": 64, "description": "Combined IKM length in octets (32 + 32)." }
      }
    },
    "coverage": {
      "type": "object",
      "description": "Which legs are executable via the Go public API and which carry data-only NIST anchors.",
      "required": ["go_public_executable", "not_go_public_executable", "disconfirmed_candidate"],
      "properties": {
        "go_public_executable": {
          "type": "array",
          "items": { "type": "string" },
          "description": "Assertions a Go public-API implementation can reproduce."
        },
        "not_go_public_executable": {
          "type": "array",
          "items": { "type": "string" },
          "description": "Legs carried as data-only because the Go public API cannot import an expanded dk."
        },
        "disconfirmed_candidate": {
          "type": "string",
          "description": "A rejected single-source candidate vector and why it must not be used."
        }
      }
    }
  }
}
