{
  "name": "X25519MLKEM768 KEM-wire KAT",
  "spec": "N-PAMP draft-00 handshake binding (spec/10) §4 (ML-KEM-first)",
  "kem_codepoint": "0x11ec",
  "provenance": "Standards-derived, non-circular. ML-KEM-768 values are from NIST ACVP (FIPS 203 final). X25519 values are from RFC 7748 §6.1. NONE of these were generated by an N-PAMP implementation. A consuming implementation that reproduces these is being checked against the standards, not against another N-PAMP build.",
  "purpose": "Pin the X25519MLKEM768 hybrid-KEM WIRE BYTE ORDER (the combiner-order surface) and the component encodings, so the wire-byte-order bug that symmetric self-interop cannot catch is caught by a standards-anchored vector in EVERY conforming implementation.",
  "mlkem768_keygen": {
    "description": "Deterministic ML-KEM-768 key generation from the FIPS 203 seed (d, z). NewDecapsulationKey768(d||z).EncapsulationKey().Bytes() MUST equal ek. Verified reproducible against Go crypto/mlkem (final FIPS 203).",
    "source": "NIST ACVP-Server, ML-KEM-keyGen-FIPS203, parameterSet ML-KEM-768, tgId 2, tcId 26",
    "source_url": "https://raw.githubusercontent.com/usnistgov/ACVP-Server/master/gen-val/json-files/ML-KEM-keyGen-FIPS203/internalProjection.json",
    "seed_form": "Go crypto/mlkem NewDecapsulationKey768 expects a 64-byte seed in d||z form (d = seed[0:32], z = seed[32:64]).",
    "d": "E582B7D75E6C80B05AE392A1FC9F7153B12390FD99930368CC67A768BAEBC8A0",
    "z": "1CDACB8740C0B87C4A379575F187B367CBFA3B300BF591B109F79816E9CBE8F0",
    "ek": "28C793778741B80B02B4339F2AA4347255B099F17264E1B8CC0A2C7C2A1A79F7997B907FD0496C6E6C8AD7714F5F339D75F11F625591A869BE1175AE47F05FD4313468232BA6957D7807B824F445AC99A0D568AB1AD54DCA8249D1482E61275F52248C77F61A4248753188CD1794CD0A465EC0DC4B025985C461B74E76286E4C37E77405695CC9FD0654374B427A20343AEC0FF1A187768273BFC4905472A1DA387F14559D6CE87313F6A5B6138434539F9A13684055B177E543F8B40F432ABD7CC49989A50A9084C660913F45A8593B17499BC4CF936C2BC1851421CB986808A0EF30AFE97AAB5B8B8EB3F0B3506A95B91563A0E57DB7231044987EF141BDAB3537C316AD16F17805A81F29329879A94E96157E4B7447F7D59603B21BD896CC47B7CD4E232322EB9C5D2215696BCFFCA3A04EFCC4C5D9CC39AC9A6E8700D38C244B0169E7FA1FE81B4B10365E74E6A1F7F756D11ACDC84043F81006D62995376C22535958FEB53F78117EE0F61C4C862640D06DC57A2B8BE62A41A642AF3BC63F6BAC98BBBBFF70570F37B8F8D9572F2735657A6C98F96CAF57A849868720B2640B8BB2732237A1F984C18872D10289CE43C952C9257E06529AEB76AFD127B17596FD25C5216C9CABD9B18EFC50E87BBB04568BB7D5C4E9288C006483AF5912E19108573700BD10CD77224B80659EA75AA74270B33AC4008B738BFEE271E78658C8742FF13C96AD0781A03C7576CA26DD58B52980BA58C0505E446AFA140CDCEA0490DB1F9B18815D4314B2459CACC562441C91F4084E5426C88E632CF7482E79907911D06473260835D7B85E7856A829AEA0381707B939CE86882CC09C4448C6AE94A9C303107C5667EEFB8DF7763CC21189A3C590C40AA51F491503A7935EC08F4FC300CBE607ED8C9100C29FBF45584B13C8D780069337AEC76C36CEB70373E2AB6E7B934B466F53FB32EAF040055496B8540E23A2A277E534468608D5EC0F8D38CEA5BBB806C1BF4F164F6AC826FE733F95461E29DCC11200C0AADA1B8332023EAB329718CE25CC0A09555903F3578BBC863B1752CA94365DA556DF54C3B7E05CBB7115FBC1B6C57A172C31B9906560C8FB54F3C563A2256CC073243B8179B4A28D60E086CF51082EE429272996F0AABE03BA0EAFD3C8E7D954BD0933E2F60ED0C32CEDE7B820A28E48F3CA3C40913CCCAE2337ABFC59843F08C9863325D65A4E9E15C1F46172B118B2B5EB0F1D5158A00134F27B085488C3A0621FE4E5678698250FB74EE5152E3E35A66544A05D279EA99131FBC15165060B90F88EEB7B20892A4DE4CB1683495BD7DA037966B47CC040F1764C5DEB06B5499D4267391CEBBB47F734D8539E39528436A1858182854BF20B1F93279AFB706464C65CCC5AE099B37CC03556C26ABF4C3F8B9BA3A936707211A49A59B268F5284F7970C77612719450377417428C4BA47C9CA115CF95304C4759C5D8859B44985C06A6C924689237BA320D610960D61C53E85431789E67A40113F167FF93429C264F6CABC95448C903437D39A6577BE0CF0012852AA476351A9046A110A1A625A3D74C910B78BCE9CFCA735E4F91B8A4C57DBE489E849446098AACF73070AEE638FCC8896473D3C159D3AFB4B687B40DFBF371A9C2644B605187B71A14BC4C8678FE8247"
  },
  "x25519_rfc7748_6_1": {
    "description": "RFC 7748 §6.1 Curve25519 Diffie-Hellman test vector. NewPrivateKey(alice_private).PublicKey().Bytes() MUST equal alice_public; ECDH(alice_private, bob_public) MUST equal shared_secret (and symmetrically for bob). crypto/ecdh applies RFC 7748 clamping internally, so the raw private scalars reproduce the published outputs.",
    "source": "RFC 7748 §6.1",
    "source_url": "https://www.rfc-editor.org/rfc/rfc7748#section-6.1",
    "alice_private": "77076d0a7318a57d3c16c17251b26645df4c2f87ebc0992ab177fba51db92c2a",
    "alice_public": "8520f0098930a754748b7ddcb43ef75a0dbf3a0d26381af4eba4a98eaa9b4e6a",
    "bob_private": "5dab087e624a8a4b79e17f8b83800ee66f3bb1292618b6fd1c2f8b27ff88e0eb",
    "bob_public": "de9edb7d7b7dc1b4d35b61c2ece435373f8343c85b78674dadfc7e146f882b4f",
    "shared_secret": "4a5d9d5ba4ce2de1728e3bf480350f25e07e21c947d19e3376f09b3c1e161742"
  },
  "mlkem768_decaps_reference": {
    "description": "NIST ML-KEM-768 encapsulation/decapsulation known-answer: ciphertext c decapsulates to shared secret K under this record's key (deterministic encaps randomness m). This is the NIST anchor for the ML-KEM SHARED SECRET. NOTE: ACVP supplies this record's decapsulation key as the EXPANDED 2400-byte dk, and Go's public crypto/mlkem imports ONLY a 64-byte seed — so this leg is NOT executable via the Go public API. It IS executable by implementations that can import an expanded decapsulation key, and K is reused as the ML-KEM shared secret in combined_secret below.",
    "source": "NIST ACVP-Server, ML-KEM-encapDecap-FIPS203, parameterSet ML-KEM-768, function encapsulation, testType AFT, tgId 2, tcId 26",
    "source_url": "https://raw.githubusercontent.com/usnistgov/ACVP-Server/master/gen-val/json-files/ML-KEM-encapDecap-FIPS203/internalProjection.json",
    "encaps_randomness_m": "7D5201502FAD05B1463BC2212D6AEC1C8503204C491F12D9366AE750144B7831",
    "shared_secret_K": "11B62291B1A9D307C8240D70BE0B45436DB445793173F6E79FCD2B273D7F3B01",
    "ciphertext_c": "04F4A18C69708A17F561778B2AC10D94380ABEA4A20835939C9015D78DAC41A5012CED1BED948AED6C79193F8B2FC6DEABD3B092EC33AE2F54778F1C54CE762A69521764E20C05BC2EF96992F463CA95D09DD588AF622C297BBD8805113E985388FC9E16FDA06B5EED42DA629D514F86ED84ACFF0A09418E720201B794B49D072DF15E7B7D6EC6D82379A212C71C7603A1C9BBE57FB1CB9A431DE1980ECADA0A4FBF5CACE9AD0CEEDBFDC40761839D9CC1C8590EB6335179075892A8015E04ECADAD37FDCD4644EC2284CF4CBB4620FBAB6055A163E3733E3A7747044B766EBC356436B33E28FA4E67B083592B05811361445C719F6AE8ADD4EF8CE145E3933CEE75D19E98BB964D58044B6DE2B46107F80C3D4690114CC84FB0D3B3D4C3AF671EA7B833746B54FCE5CC761CA4FD20CD163AFA849E5797619C31144A74140ABE1C7540D1A3C557A9F23AF6E6E3523667FFD13B92444CD3BE01B1581CA0CF7A536CE4C073DC17DE955BA22E469BC1C0EC213B3B7CEDDFC47567A7ECFC2A58A6C2A3C2185563277866F8979BBB86AF844349C6021EB9926ACFE0188FD0F809E056A8E0A8AAA2A4208562E775EF60C56CADD6E26A9E52D60187BF6ED0565616020E0C2BFD79D961B1069FF261B2ABF40C9EE2A2C442877F4EDB8D9AD717CB434FED67EF2EACD629DA1CE78023548853EEAF7D998923DB7CEB0174E67875E787F398435DA84C26B478FF6BF785C4714BC6F8E91804E10CC699E1BE342C952D57D3C84654D603709F4F6BB596E022E2E6149C81025226B9925045FF365D83991F7D4C8693544CA7BA6DA60F8E4F6723C9F14AC48882556336ED88C20163544C55AB4238E510AA910B04F445252D507AF02AD24E7467920C81F2D31A71A7241BE2726BB9F8B20BF2100633F616A1233801EB37597DDBE2DEF36EF0727515E7DA178DA7760A41EDF9FFE98FBAA3495A35025F2BD100B3D63E940BA7D997104AC67F653D0A24A2BA2C8A355AF1EE048CB116B1A492577CC7CF61226FBBBABD9CBB043839585F2E00AE673EE6BECAAF5DA7919921C90C74D5B8B173B8A1A650F379B3B5E5F1D04538B936FC2CD0D4F8B9DF9F5052ECD9E66602815B4F96586D038D5BD5A3E44BDE1EF9FF9CFCB6B9AECE3129EF1F026BEFD299A7A8AD324149B156BC5AB868099DF52A2056103432879B495B0655FC1FE8073B502F3F40D403548B1629118CE0EDD41558E4215E8E241A45637A3434BF070F17DAC885ED656F80783A4C47000464FE78B9DB0DBB55895E271D3376BF0C50CEC9A403A8729982DC5B9172B5E80A0EF03FA2A24873188F8022A6F9DA8CA4F2E24AA7E29987B1060ECFE0B08E039EE1F7FB55A0CD35A73B6C25DC26E469BBC2D034265DB5F74E644842BB99199F83947C97BF87532B37A8D40A06F8BC5508EFB117D11DFB07325D9482CDCE60AA34529546D4C8D8F98E3F5B34B5C757075FEE9C3443E0A1109253F5F0A905C571E5343B277E0636A5A46AB36BECF5672E93B712B9BC8E3CD3656CAD1B29C16E"
  },
  "wire_layout": {
    "description": "How an implementation MUST assemble the on-wire fields from the components above, per spec/10 §4 (ML-KEM-first). These are the assertions a conforming implementation must satisfy.",
    "kem_share": "ek (1184) || x25519 alice_public (32) = 1216 octets (TLV 0x07). ML-KEM-first.",
    "kem_ciphertext": "ml-kem ciphertext (1088) || server x25519 public (32) = 1120 octets (TLV 0x08). ML-KEM-first.",
    "combined_secret": "ml-kem shared secret (32) || x25519 shared secret (32) = 64 octets, the raw IKM to HKDF-Extract (spec §4/§5.2). ML-KEM-first. For this vector: combined_secret = mlkem768_decaps_reference.shared_secret_K || x25519_rfc7748_6_1.shared_secret.",
    "kem_share_len": 1216,
    "kem_ciphertext_len": 1120,
    "combined_secret_len": 64
  },
  "coverage": {
    "go_public_executable": [
      "mlkem768_keygen: NewDecapsulationKey768(d||z).EncapsulationKey().Bytes() == ek (NIST-anchored)",
      "x25519: NewPrivateKey/PublicKey/ECDH reproduce RFC 7748 §6.1 (RFC-anchored)",
      "kem_share order: assembled ek||alice_public, ML-KEM-first (NIST ek + RFC pub)",
      "kem_ciphertext order: client DeriveSharedSecrets of (ct||bob_public) recovers the X25519 shared secret == RFC K (RFC-anchored; the ct here is generated by encapsulating to ek, so the ML-KEM shared-secret VALUE on this leg is round-trip, not NIST-anchored)",
      "combined_secret/IKM order: HKDF-Extract IKM is ML-KEM_SS || X25519_SS, not the reverse"
    ],
    "not_go_public_executable": [